url,type,textinteramark.com,service," Menu Newsletters Search Health Conditions A-Z Cancer Cold & Flu Crohn's Disease Depression Eczema Multiple Sclerosis Psoriasis Rheumatoid Arthritis Type 2 Diabetes Ulcerative Colitis See All Wellness Sleep Stress Emotional Wellness Alternative Therapies Fitness Sex & Relationships Healthy Skin Resilience Special Reports See All Food & Eating Ketogenic Diet Intermittent Fasting Paleo Diet Mediterranean Diet Low-Carb Diet Atkins Diet DASH Diet MIND Diet See All Health Tools Symptom Checker Drugs & Supplements Hydration Calculator DailyOM Wellness Courses News & Alerts Children Will Listen. But What Should You Say to Them After the Texas School Massacre? ‘Broken Heart’ Killed Husband of Slain Uvalde Teacher, Family Says Coronavirus / COVID-19 Your Daily COVID-19 Alert What Is a Coronavirus? Tippi Coronavirus: Tips for Living With COVID-19 Coronavirus and COVID-19: All Resources   How to Talk to Your Children After a School Shooting: Expert Q&A Child and adolescent psychotherapist Katie Hurley answers questions about what parents can say to their children after traumatic incidents like the school shooting in Texas. By George Vernadakis Today's Top Stories ‘Broken Heart’ Killed Husband of Slain Uvalde Teacher, Family Says Broken heart syndrome is rare, with symptoms like chest pain and shortness of breath that can mimic a heart attack and prove fatal. By Lisa Rapaport How COVID-19 Attacks the Body: Lessons From the Morgue By Judy Melinek, MD Leroy Sims, MD, Helped Create the NBA Bubble at the Start of the Pandemic The NBA's SVP of medical affairs, Dr. Sims led the way to safely restart the 2019–2020 basketball season. By Maura Corrigan Facebook Twitter Instagram Follow us and never miss out on the best in health news. More Recent Articles As Trauma Surgeons, We See Gun Violence for What It Is: A Public Health Crisis The Mental Health Toll of Mass Shootings Is Organic Produce Healthier Than the Conventional Kind? Are Plant-Based Alternatives to Meat Actually Healthier? Expert Health Advice for Common Chronic Conditions Get medically reviewed stories, tips, and resources. Psoriatic Arthritis Rheumatoid Arthritis Cancer Diabetes Digestive Health Emotional Health Migraine Psoriasis ‘Broken Heart’ Killed Husband of Slain Uvalde Teacher, Family Says Broken heart syndrome, also called stress cardiomyopathy, can happen in people grieving a sudden loss of a lov... By Lisa Rapaport COVID-19 Testing for Travel: If, When, Where, and How COVID-19 testing can make travel safer as long as you do it correctly. Here experts share strategies for testi... By Salma Abdelnour Gilman Spotlight On: Cancer and Careers Cancer and Careers is an organization that supports patients and survivors as they try to navigate their caree... By Leona Vaughn Wellness Is More Than a Buzzword Read personal perspectives and insights on health and wellness. Diet & Nutrition Healthy Recipes Meditation Fitness Healthy Living Wellness Self-Care Is Organic Produce Healthier Than the Conventional Kind? Spending on organic produce is on the rise, but are organically grown fruits and vegetables really healthier t... By Sari Harrar 7 Copycat Takeout Recipes, Only Healthier Eating out has been associated with negative health outcomes, but you can make these healthy recipes for fried... By Kelly Kennedy, RDN All Meditation Articles The latest news and information on Meditation. Tools designed to help you make healthier decisions Symptom Checker Tell us how you’re feeling for suggested next steps and treatment plans. Drugs and Supplements Everything you need to know about prescription and OTC drugs. Recipes From breakfast ideas to no-guilt desserts, prepare dishes that are healthy and delicious. Check In, Check Up Holistically evaluate your condition management by taking these assessments. The Visit With this interactive IBD appointment experience, you decide what you want to learn next. Stay In the Know With News You Can Use Get all the latest breaking news and health information. Children Will Listen. But What Should You Say to Them After the Texas School Massacre? Child and adolescent psychotherapist Katie Hurley answers questions about what parents can say to their children after traumatic incidents like the school shooting in Texas. By George Vernadakis Reviewed: May 27, 2022 ‘Broken Heart’ Killed Husband of Slain Uvalde Teacher, Family Says Broken heart syndrome, also called stress cardiomyopathy, can happen in people grieving a sudden loss of a loved one. By Lisa Rapaport Reviewed: May 27, 2022 Frequent Use of Antibiotics Tied to Inflammatory Bowel Disease in Older Adults A study found that the risk of IBD increased for seniors who were prescribed multiple rounds of antibiotics. By Adam Meyer Reviewed: May 26, 2022 Subvariants Are Fueling a Rise in COVID-19 Cases BA.2.12.1, a subvariant of the omicron variant BA.2, has now become the dominant strain in the United States. Scientists are keeping close tabs on this version of the virus and other mutations as case numbers in many regions of the world climb. By Don Rauf Reviewed: May 26, 2022 FDA Names Dupixent as the First and Only Approved Drug to Treat Eosinophilic Esophagitis (EoE) The monoclonal antibody improves the clinical signs and symptoms of the immune-related inflammatory disease. By Becky Upham Reviewed: May 26, 2022 See All Boxed In: COVID-19 and Your Mental Health Boxed In: What COVID-19 Has Taught Us About Racism As a Public Health Crisis Up Next Boxed In: Season 2, Episode 1: The Pandemic's Psychological Impact on Children Boxed In Season 2, Episode 2: ‘COVID-19 Long Haulers and the Patient Support Movement’ Boxed In: COVID-19 and Your Mental Health For more episodes and information on mental health and the coronavirus, check out the Boxed In page. Boxed In: ‘What COVID-19 Has Taught Us About Racism as a Public Health Crisis’ In this episode, psychiatrist and Everyday Health Medical Editor in Chief Patrice Harris, MD, discusses how disparities within the healthcare system lead to vastly different health outcomes for Black Americans. By Maureen Connolly Consumer’s Guides: Understand Your Treatments JAK Inhibitors for Severe Eczema JAK Inhibitors for Psoriatic Arthritis Botulinum Toxin for Chronic Migraine Dual Orexin Receptor Antagonists for Insomnia Biologics for Atopic Dermatitis Targeted Therapies for EGFR+ Non-Small-Cell Lung Cancer Nonstimulant Drugs for ADHD JAK Inhibitors for RA Biologics for Psoriasis See More The Best Health Tips From Our Community Self-care tips, wellness advice, and aha moments from our condition communities and healthcare professionals Explore All Tippis Tips for Living Well During the COVID-19 Pandemic 683+ Helpful Tips Shared Tips for Living With Eczema 151+ Helpful Tips Shared Tips for Living With Rheumatoid Arthritis 716+ Helpful Tips Shared Tips for Living With Type 2 Diabetes 183+ Helpful Tips Shared Tips for Living With Multiple Sclerosis 797+ Helpful Tips Shared Tips for Living With Psoriatic Arthritis 454+ Helpful Tips Shared Tips for Living With Immune Thrombocytopenia 62+ Helpful Tips Shared Tips for Living With Endometriosis 398+ Helpful Tips Shared On Trend: An Everyday Health Original Series On-demand classes inspired by the latest wellness trends, made for people managing chronic conditions. NEWSLETTERS Get the latest from our Healthy Living newsletter! Enter your email Subscribe By subscribing you agree to the Terms of Use and Privacy Policy . INSPIRING STORIES, TOP EXPERTS, AND TIPS TippiTV Crohn’s Disease: The Reunion We’ve reunited our TippiTV participants for an honest conversation on life with Crohn’s, covering everything from food and treatment to the impact of COVID-19, their relationships, and cultural influences. By Katherine Lee Reviewed: May 4, 2021 Episode 1: A Musician's Key to Success Can the Tippi Team give this LA performer and yogi what he needs to find harmony — and keep it? By Erin Coakley Reviewed: April 30, 2020 Episode 2: Midwestern Mom vs. Food Myra loves to cook, but Crohn’s has turned food into her nemesis. The Tippi Team offers some tips and tricks. By Erin Coakley Reviewed: April 30, 2020 Episode 3: Ready and…Action! Writer and producer Tina doesn’t want Crohn’s to hold her back from her career. The Tippi Team rallies to help her take control. By Erin Coakley Reviewed: April 30, 2020 Featured Health Topics Managing Difficult-to-Treat Eczema Is Dry Eye Interfering With Your Quality of Life? Living an Active Life With Rheumatoid Arthritis Navigating Non-Small-Cell Lung Cancer MORE FEATURED HEALTH TOPICS Looking Sharp: Living With Age-Related Farsightedness A Gut Feeling: Your Guide to Managing Ulcerative Colitis Adjusting to ADPKD Finding Strength: Life With RA How Much Do You Know About Your Tenosynovial Giant Cell Tumor (TGCT) Diagnosis? How to Better Manage Psoriatic Arthritis, Right Now How to Find the Best Psoriatic Arthritis Care How to Manage Exocrine Pancreatic Insufficiency How to Treat Thyroid Eye Disease Learning All About Sexual Health, HIV/STDs, and HIV Prevention Provided by PRIME Learning How to Prevent or Better Manage COVID-19: A Patient and Caregiver Education and Resource Center Provided by PRIME Living With Dupuytren’s Contracture See More From Our Advertising Sponsors An Important Medical Breakthrough, and Big Change in the Fight Against Cancer A Different Pill for Ulcerative Colitis (UC): What You Need to Know Discover a Nonsurgical Treatment for Peyronie’s Disease (PD) How a Once-Daily Pill for Ulcerative Colitis Is Meant to Help How I Took an Active Role in My Blood Cancer Treatment XIAFLEX® (collagenase clostridium histolyticum) — A Nonsurgical Option for Dupuytren’s Contracture ABOUT US Our mission is to inspire and enable wellness each and every day. Learn more about us. WE’RE EXPERTS IN WELLNESS Our content on more than 120 health conditions is medically reviewed by physicians and healthcare providers in active clinical practice. Learn more about our editorial team. RELEVANCE AND CREDIBILITY Our Wellness Advisory Board includes some of the nation’s leading health experts to help you make more informed decisions on how to live better. Learn more about our Wellness Advisory Board. Wellness inspired. Wellness enabled. Facebook Twitter Instagram Pinterest Youtube TikTok About Us Careers Editorial Policy Newsletters Privacy Policy Health News Accessibility Statement Terms of Use Contact Us Feedback Do Not Sell My Personal Information Popular Topics AdChoices NEWSLETTERS Get the best in health and wellness Enter your email Subscribe By subscribing you agree to the Terms of Use and Privacy Policy . A PROPERTY OF EHGLogo More From Everyday Health: Castle Connolly Top Doctors DailyOM Diabetes Daily Migraine Again © 1996-2022 Everyday Health, Inc. Everyday Health is among the federally registered trademarks of Everyday Health, Inc. and may not be used by third parties without explicit permission. Badges Badges Badges     "
interamark.com,service,"Health Conditions Discover Plan Connect Shop Subscribe Please accept our privacy policy Healthline uses cookies to improve your experience and to show you personalized ads. Privacy Policy . ACCEPT  More information Why We Need to Treat Gun Violence as a Health Crisis Experts say we need to reframe the impact of gun violence as a medical issue, not a political one. Mindfulness Techniques for Coping with Trauma Here’s how to approach meditation through a trauma-sensitive lens. Explore By View all  Nutrition Sleep Mental Health Fitness Product Reviews THIS JUST IN How to Stay Informed Without Being Overwhelmed by Stressful News The 24-hour news cycle can feel all-consuming. Try these tips to find balance. How Adults Can Help Improve the Mental Health of Black Youth Tips for parents and adults to help Black youth feel heard and supported. Ditching Social Media for Just 1 Week Can Boost Your Mental Health Experts share tips to have a healthier relationship with social media. The 18 Best Books About Anxiety for Kids of All Ages Kids may not have the words to explain their feelings. These books can help. MORE TOP READS Your Guide to Creating a Healthier Relationship with Social Media Why Social-Emotional Learning Is So Important for Kids Right Now How We Can Actually Improve Our Work-Life Balance — for Good Healthline’s Picks: The Best Online Teen Counseling Programs Health Conditions View all  Type 2 Diabetes Inflammatory Bowel Disease Multiple Sclerosis Breast Cancer Rheumatoid Arthritis Product Reviews View all  Vitamins & Supplements Sleep Mental Health Nutrition CBD SPOTLIGHT Science and integrity matter to us At Healthline, we set high standards of quality, research, and transparency for what we share, ensuring you have access to nothing but the best. Here's how: To ensure accuracy, each of our 20,000+ articles is reviewed by a medical subject matter expert such as a doctor, nurse, or therapist. Our recommendations are current and based on research thanks to our diligent health and medical monitoring standards. Featured brands are reviewed for medical credibility, business practices, and social impact. Read about our process Explore Our Sponsored Topics View all  Knowledge Is Power with Ulcerative Colitis Knowledge Is Power with Early Breast Cancer Moving Forward with Advanced COPD No Rheum for RA Pain About Us Contact Us Privacy Policy Privacy Settings Advertising Policy Health Topics Medical Affairs Content Integrity Newsletters © 2005-2022 Healthline Media a Red Ventures Company. All rights reserved. Our website services, content, and products are for informational purposes only. Healthline Media does not provide medical advice, diagnosis, or treatment. See additional information . © 2005-2022 Healthline Media a Red Ventures Company. All rights reserved. Our website services, content, and products are for informational purposes only. Healthline Media does not provide medical advice, diagnosis, or treatment. See additional information . About Careers Advertise with us OUR BRANDS Healthline Medical News Today Greatist Psych Central  "
interamark.com,service,"                  COVID-19: Advice, updates and vaccine options  Find out about COVID-19 , COVID-19 vaccines , and Mayo Clinic patient and visitor updates .       Skip to site navigation  Skip to Content    This content does not have an English version. This content does not have an Arabic version.      Search    Search         Request an Appointment  Find a Doctor  Find a Job  Give Now      Log in to Patient Account   English   Español  Português  العربية  简体中文      Twitter  Facebook  Pinterest  YouTube     Menu    Care at Mayo Clinic    Care at Mayo Clinic  Appointments  Locations  Patient & Visitor Guide  International Services  Medical Departments & Centers  Doctors & Medical Staff  Patient Online Services  Billing & Insurance  Clinical Trials  International Business Collaborations  About Mayo Clinic  Contact Us      Health Information    Health Information  Diseases & Conditions A-Z  Symptoms A-Z  Tests & Procedures A-Z  Drugs & Supplements A-Z  Health Books  Healthy Living Program  Mayo Clinic Health Letter  Mayo Clinic Voice Apps  Healthy Lifestyle     Featured conditions  Brain tumor , breast cancer , colon cancer , congenital heart disease , heart arrhythmia . See more conditions .     For Medical Professionals    For Medical Professionals  Provider Relations  CareLink Online Referrals  Continuing Medical Education  Mayo Clinic Laboratories  AskMayoExpert  Video Center  Journals and Publications      Research    Research  Research Faculty  Laboratories  Core Facilities  Centers & Programs  Departments & Divisions  Clinical Trials  Institutional Review Board  Postdoctoral Fellowships  Training Grant Programs      College of Medicine and Science    College of Medicine and Science  Mayo Clinic Graduate School of Biomedical Sciences  Mayo Clinic Alix School of Medicine  Mayo Clinic School of Continuous Professional Development  Mayo Clinic School of Graduate Medical Education  Mayo Clinic School of Health Sciences      Giving to Mayo Clinic    Giving to Mayo Clinic  Give Now  Philanthropy in Action  Frequently Asked Questions  Contact Us to Give     Request an Appointment  Find a Doctor  Find a Job  Give Now  Log in to Patient Account    Twitter  Facebook  Pinterest  YouTube            Mayo Clinic                 When you need answers, you know where to go.  The No. 1 hospital in the nation, for you.         Request an appointment        Log in to Patient Account        Search diseases & conditions                Why choose Mayo Clinic?  Learn more about Mayo                             Clinic             More experience  The million patients we treat each year prepares us to treat the one who                             matters most—you.          The right answers  Count on our experts to deliver an accurate diagnosis and the right plan for                             you the first time.             You come first  Treatment at Mayo Clinic is a truly human experience. You’re cared for as                             a person first.                   Innovation with impact  All of our patient care, education and research are driven to make discoveries                             that can help heal you.   Learn more                         about Mayo Clinic           COVID-19 updates  Check our COVID-19                             resource center for patient and visitor guidelines and trusted health                         information.    Vaccine options by location  Arizona       Florida       Rochester, Minnesota       Mayo                         Clinic Health System         U.S. COVID-19 map   Check cases and your                         local forecast              The No. 1 hospital  Mayo Clinic is the No. 1 hospital overall.         International services at Mayo Clinic  The trusted leader in healthcare worldwide.         Give now  Your generous support leads to breakthrough results.         When you need answers,                     you know where to go.  The unknown is just a question. We find the answers.                     Search diseases & conditions  Search for a disease or condition by its first letter.          Find a condition that begins with the letter A  A      Find a condition that begins with the letter B  B      Find a condition that begins with the letter C  C      Find a condition that begins with the letter D  D      Find a condition that begins with the letter E  E      Find a condition that begins with the letter F  F      Find a condition that begins with the letter G  G      Find a condition that begins with the letter H  H      Find a condition that begins with the letter I  I      Find a condition that begins with the letter J  J      Find a condition that begins with the letter K  K      Find a condition that begins with the letter L  L      Find a condition that begins with the letter M  M      Find a condition that begins with the letter N  N      Find a condition that begins with the letter O  O      Find a condition that begins with the letter P  P      Find a condition that begins with the letter Q  Q      Find a condition that begins with the letter R  R      Find a condition that begins with the letter S  S      Find a condition that begins with the letter T  T      Find a condition that begins with the letter U  U      Find a condition that begins with the letter V  V      Find a condition that begins with the letter W  W      Find a condition that begins with the letter X  X      Find a condition that begins with the letter Y  Y      Find a condition that begins with the letter Z  Z      Find a disease that starts with a number  #        Symptom Checker  Check your symptoms to find a possible cause.        Featured topics   Bone marrow transplant  Brain aneurysm  Brain tumor  Breast cancer  Colon cancer  Congenital heart disease  Glioma  Heart arrhythmia  Heart valve disease  Living donor transplant  Lung transplant  Rectal cancer   See more diseases and conditions                      Locations and directions  Learn more about Mayo Clinic                             locations . Or choose a specific location.          Scottsdale & Phoenix  Mayo Clinic in Arizona       Jacksonville  Mayo Clinic in Florida       Rochester  Mayo Clinic in Minnesota       Upper midwest  Mayo Clinic Health System        London  Mayo Clinic Healthcare            Mayo Clinic is a not-for-profit organization.  Make a                     donation                 For Medical Professionals   Find a doctor  Refer a patient  View clinical trials   For Students   View degree programs  View admissions requirements  Log in to the student portal   For Mayo Clinic Faculty and Staff   Find a doctor  Find other career opportunities   For the Media   Media requests       For Researchers   Find an expert in a research area  View Mayo Clinic's lab services   For Job Seekers   View open positions  Working at Mayo Clinic   For International Patients   Request an appointment  Financial services  International offices   Charitable Care & Financial Assistance   Arizona financial assistance documents  Florida financial assistance documents  Minnesota financial assistance documents  Community Health Needs Assessment (CHNA)       Follow Mayo Clinic   Twitter  Facebook  YouTube  Pinterest   Free E-Newsletter  Get our free e-newsletter to stay up to date on the latest health information from experts at Mayo Clinic.  Your Gift Holds Great Power  Make your tax-deductible gift today, and be a part of cutting-edge research and care that's changing medicine as it's known today.  Make a donation            sitecore  content  Web  GBS  Home            Footer Navigation Links          Request Appointment Contact Us About Mayo Clinic Employees Find a Job Site Map About This Site    Twitter Facebook Pinterest YouTube    Mayo Clinic is a not-for-profit organization. Make a donation.      Footer Tiles   Any use of this site constitutes your agreement to the Terms and Conditions and Privacy Policy linked below.  Terms and Conditions  Privacy Policy  Notice of Privacy Practices  Notice of Nondiscrimination  Manage Cookies  A single copy of these materials may be reprinted for noncommercial personal use only. ""Mayo,"" ""Mayo Clinic,"" ""MayoClinic.org,"" ""Mayo Clinic Healthy Living,"" and the triple-shield Mayo Clinic logo are trademarks of Mayo Foundation for Medical Education and Research.  This site complies with the HONcode standard for trustworthy health information: verify here.     © 1998-2022 Mayo Foundation for Medical Education and Research (MFMER). All rights reserved.               "
