url,type,text
interamark.com,service,"      Skip to main content           Find infant formula resources for your family during the voluntary recall - English | Spanish | Vietnamese | Creole        HHS .gov    Search    U.S. Department of Health & Human Services    Menu  About HHS   Programs & Services   Grants & Contracts   Laws & Regulations         Search                       Close     A-Z Index         About HHS   Programs & Services   Grants & Contracts   Laws & Regulations          Breadcrumb   Home > Digital Communications >                                 HHS Accessibility & Section 508            Text Resize A  A  A   Print   Share                  Left Nav: /web   Developers' Center   Digital Communications   Policies & Standards  has sub items, about Policies & Standards   HHS Web Policies   Terms of Service Agreements     Accessibility  has sub items, about Accessibility   HHS Accessibility & Section 508 Policy   Compliance Checklists   Accessibility Resources   OS Accessibility Program   Training Resources       Building & Managing Websites  has sub items, about Building & Managing Websites   New & Redesigned Websites   Managed Websites   Mobile   Content Syndication     Social Media  has sub items, about Social Media   Getting Started   Policies   Resources     Services & Resources   Governance  has sub items, about Governance   Digital Strategy   21st Century IDEA   Members     About ASPA Digital           Accessibility @ HHS        HHS' Role in Accessibility  The department has an obligation to its employees and members of the public to provide the same (or comparable) access to, and use of, information and services from an HHS OpDiv sought by each and every individual. As a department, we believe everyone is accountable and responsible for accessibility conformance.  The accessibility field encompasses many types of technology, standards and guidelines. As a department of the federal government, we are required to abide by the Section 508 legislation. Section 508 of the Rehabilitation Act of 1973, codified at section 29 USC 794d, as amended, ensures those with disabilities have equal access to government information as contained on information and communications technology (ICT), and thereby to the government employment, programs and services to which all citizens are entitled. Section 508 is only one segment of the accessibility field. As use of information technology has greatly increased within the workplace, and out, in recent years, and additional legislation has required ever-more access to government information, there is a great need for strong, effective action to ensure compliance across the department.  At the department-level accessibility actions and implementation are demonstrated through the following examples:  HHS-wide standards, policies, guidelines, and criteria for Section 508 and accessibility.  Collaboration internally, and externally, on best practices and lessons learned about Section 508 within acquisitions, training, evaluations, and other areas.  Section 508 and accessibility information and resources available on the HHS intranet and internet  Participation in the Federal Chief Information Officer Council Community of Interest (CIOC)  Bi-annual data collection for the General Services Administration (GSA) Section 508 Maturity Metrics  Responses to federal accessibility mandates on behalf of the department  Representation of the department at federal or interagency activities related to Section 508.  Contact the OS Accessibility Program  Feedback and inquiries regarding accessibility and Section 508 pertaining to the Department or OS can be directed to the HHS Accessibility Help Desk . Requests for training or conformance evaluation are encouraged.             Content created by Digital Communications Division (DCD) Content last reviewed June 30, 2020                       Connect With Us                  Sign Up for Email Updates  Receive the latest updates from the Secretary, Blogs, and News Releases.   Sign Up     HHS Headquarters  U.S. Department of Health & Human Services 200 Independence Avenue, S.W. Washington, D.C. 20201 Toll Free Call Center: 1-877-696-6775​            Contact HHS    Careers    HHS FAQs    Nondiscrimination Notice        HHS Archive    Accessibility    Privacy Policy    Viewers & Players        Budget/Performance    Guidance Portal    Inspector General    EEO/No Fear Act        FOIA    The White House    USA.gov    Vulnerability Disclosure Policy                  Back to T op      "
interamark.com,service,"  Skip to main content              Drugs A-Z  Pill Identifier  Interactions Checker  New Drugs  Pro Edition  More Resources     Register  Sign In     Site navigation            Account   Sign In  Create an account    Drugs A-Z  Pill Identifier  Interactions Checker  News & Alerts  Pro Edition  More Resources       Find Drugs & Conditions     Search Drugs.com     Search      Trending searches: amlodipine , gabapentin , aspirin , lisinopril , amoxicillin             Drugs & Medications       Pill Identifier       Interactions Checker       Side Effects       Conditions & Diseases       Treatment Guides       Compare Drugs       My Med List       Discount Card       FDA Alerts       Price Guide       Phonetic Search       Health Professionals       Previous     Next            Browse Drugs    Browse Conditions       A  B  C  D  E  F  G  H  I  J  K  L  M  N  O  P  Q  R  S  T  U  V  W  X  Y  Z  0-9  Advanced Search    Browse A-Z: Drug , Treatment , Condition or Class      A  B  C  D  E  F  G  H  I  J  K  L  M  N  O  P  Q  R  S  T  U  V  W  X  Y  Z  0-9    See also: Care Guides , Harvard Health Guides       Browse by Site Section    Drugs A-Z  Side Effects Checker  Dosage Guidelines  Manage your Meds  Mobile Apps  Health Professionals  Medical News  FDA Alerts  New Drugs  More Resources               FDA Medwatch Alerts  Teva Issues Voluntary Nationwide Recall of One Lot of Anagrelide Capsules, USP 0.5 mg Due to Dissolution Test Failure          New Drug Approvals  FDA Approves Fylnetra (pegfilgrastim-pbbk), a Biosimilar to Neulasta          Medical News  U.S. Making It Easier to Access COVID Treatment Paxlovid                  Drug Information   A to Z Drug List  Treatment Options  Drugs by Class  Dosage  Side Effects  Medical Q & A  Generic Drugs  Harvard Health Guide  Mayo Clinic Disease Reference  Phonetic Search  Pregnancy Warnings  OTC Database  Inactive Ingredients  Veterinary Drugs  International Drugs  Info en Español  Pricing & Coupon Guide   Tools   Interactions Checker  Pill Identifier  Symptom Checker  Medication Record  Mobile Apps  Drug Imprint Codes  Community Support  Compare Drugs   News & Alerts   Medical News  Clinical Trial Results  FDA Drug Alerts  FDA Consumer Updates  New FDA Approvals  New Drug Applications  Drug Shortages  Video Center  Popular Articles  Health & Medication Slideshows   Professionals   Resource Center  Patient Care Notes      Top 100 Drugs     Abilify  Acetaminophen  Adderall  Alprazolam  Amantadine  Ambien  Amitriptyline  Amlodipine  Amoxicillin  Ativan  Atorvastatin  Azithromycin  Baclofen  Belsomra  Benadryl  Benzonatate  Brilinta  Bunavail  Buprenorphine  Bupropion  Buspirone  Cephalexin  Cetirizine  Ciprofloxacin  Citalopram  Clindamycin  Clonazepam  Clonidine  Cosentyx  Cyclobenzaprine  Cymbalta  Dexamethasone  Diazepam  Diclofenac  Doxycycline  Duloxetine  Dupixent  Eliquis  Enbrel  Ezetimibe  Famotidine  Farxiga  Fluoxetine  Furosemide  Gabapentin  Humira  Hydrochlorothiazide  Hydrocodone  Hydroxyzine  Ibuprofen  Jardiance  Klonopin  Levothyroxine  Lexapro  Lisinopril  Loratadine  Lorazepam  Losartan  Lyrica  Meloxicam  Metformin  Methadone  Methocarbamol  Metoprolol  Metronidazole  Miralax  Mirtazapine  Mucinex  Naloxone  Naltrexone  Naproxen  Omeprazole  Ondansetron  Otezla  Oxycodone  Ozempic  Pantoprazole  Penicillin  Percocet  Phentermine  Prednisone  Prolia  Promethazine  Propranolol  Prozac  Repatha  Restasis  Rexulti  Rytary  Seroquel  Sertraline  Sildenafil  Sinemet  Spironolactone  Stelara  Sublocade  Suboxone  Subutex  Tamsulosin  Tizanidine  Toradol  Toujeo  Tramadol  Trazodone  Trelegy  Trintellix  Tylenol  Ubrelvy  Valium  Vascepa  Venlafaxine  Viagra  Vivitrol  Vraylar  Vyvanse  Wellbutrin  Xanax  Zetia  Zoloft  Zyrtec    More A-K · More L-Z · By Class          Drugs.com is the most popular, comprehensive and up-to-date source of drug information online. Providing free, peer-reviewed, accurate and independent data on more than 24,000 prescription drugs, over-the-counter medicines & natural products.      Shield Your Eyes From Summer Sun You probably slather on sunscreen to protect your skin, but your eyes need protection from the sun's rays, too. Wearing sunglasses can be protective and... today  Medical FDA Approves Fylnetra (pegfilgrastim-pbbk), a Biosimilar to Neulasta (BUSINESS WIRE)-- May 27, 2022 -- Amneal Pharmaceuticals, Inc. (NYSE: AMRX) (“Amneal” or the “Company”) today announced that the... 2 days ago  New Drug Approvals Codagenix Initiates Phase 1 Evaluation of Intranasal Vaccine CoviLiv for Use as COVID-19 Booster FARMINGDALE, N.Y., May 25, 2022. Codagenix Inc., a clinical-stage synthetic biology company with a rational vaccine design platform aimed at infectious... 3 days ago  Clinical Trials Dangerous Tanning Is on the Rise, Suntan Myths Persist: Poll While most people probably know it's not safe to get a sunburn, many may not realize that tanning also increases the risk of skin cancer and premature... 2 days ago  Medical Not Just 'Gluten-Sensitive': What People With Celiac Disease Want You to Know Hayden Bishop can't help but feel terribly self-conscious when she goes out to eat with friends and family. Bishop has celiac disease, a serious autoimmune... 2 days ago  Medical Almost 2,000 Years Later, Scientists Map Genome of Resident of Pompeii The DNA of a man who died in Pompeii, Italy, after the eruption of Mount Vesuvius in 79 AD is revealing surprising new secrets about the ancient world. Scientists... 2 days ago  Medical Devastating Injuries When Children Swallow Button Batteries Those button batteries that power your watch, key fob and other devices can be deadly if a child swallows them, and researchers want to make the danger... 2 days ago  Medical High-Tech Pacemaker Reads Body Signals, Dissolves After Use Researchers are another step closer to bringing heart patients a temporary ""smart"" pacemaker that simply dissolves once it's no longer needed. Pacemakers... yesterday  Medical 9 Monkeypox Cases Confirmed in United States Nine cases of monkeypox had been confirmed in seven states as of Wednesday, and there are likely to be more cases as a worldwide outbreak continues, U.S.... 2 days ago  Medical Expert Tips to Help Parents Cope With Baby Formula Shortage As U.S. parents struggle to find formula to feed their infants during a nationwide shortage, they may not know what to do. Experts from Penn State Health... 2 days ago  Medical U.S. Making It Easier to Access COVID Treatment Paxlovid FRIDAY, May 27, 2022 – Getting ahold of the COVID-19 antiviral treatment Paxlovid could get easier, the White House announced on Thursday. ""We want... 2 days ago  Medical When States Legalize Pot, More Teens Light Up Pot use among U.S. minors increases when states legalize recreational cannabis for adults, according to a new study. University of California, San Diego... 2 days ago  Medical After Another Senseless Tragedy, Study Shows Guns Now Leading Killer of U.S. Youth Days after the second-deadliest elementary school shooting in U.S. history, experts note that guns are now the leading cause of death for American children. Nineteen... 2 days ago  Medical Breastfeeding May Boost a Child's Brainpower, Study Shows Breastfeeding has long been thought to help boost a child's IQ, but other factors such as mom's education level and/or social standing could also be responsible... 2 days ago  Medical Sperm Counts Rebound When Obese Men Shed Pounds When men shed extra pounds and keep them off, the health benefits may extend all the way to their sperm count, a new study finds. The study, of nearly... 2 days ago  Medical Moleculin Commences Dosing in Healthy Volunteers in Phase 1a Clinical Trial of WP1122 for the Treatment of COVID-19 HOUSTON, May 26, 2022,  Moleculin Biotech, Inc., (""Moleculin"" or the ""Company""), a clinical stage pharmaceutical company with a broad portfolio of... 2 days ago  Clinical Trials New pivotal data demonstrate clinical benefit of Roche’s glofitamab, a potential first-in-class bispecific antibody for people with aggressive lymphoma Basel, 27 May 2022 - Roche today announced that new pivotal data on its investigational CD20xCD3 T-cell engaging bispecific antibody, glofitamab, will... yesterday  Clinical Trials Breastfeeding Duration Has Modest Effect on Child's Cognition Associations between breastfeeding duration and cognitive scores persist after adjusting for socioeconomic factors and maternal cognitive ability, although... 2 days ago  News for Health Professionals Point-of-Care Lung Ultrasound Feasible for Pneumonia Diagnosis in Primary Care Point-of-care lung ultrasound in primary care is feasible and useful for investigating suspected community-acquired pneumonia (CAP), according to a study... 2 days ago  News for Health Professionals AI Aids Assessment of Indeterminate Pulmonary Nodules on CT Use of computer-aided diagnosis (CAD) improves estimation of malignancy risk for indeterminate pulmonary nodules (IPNs) on chest computed tomography (CT)... 2 days ago  News for Health Professionals  Read more news...  Recently Added  Recently added consumer and prescribing information: Vtama , Mounjaro , Camzyos , Vivjoa , Epsolay , Pluvicto , Vijoice , Hyftor , Tlando , Xelstrym   For Consumers   Cerner Multum Drug Information  IBM Watson Micromedex Advanced Consumer  Natural Product Information for the Consumer   For Professionals   FDA Professional Information  Professional Patient Advice  ASHP Monographs (AHFS DI)  IBM Watson Micromedex Carenotes  Natural Product Information   For Researchers   Pharmaceutical Company Directory   Latest FDA New Drug Approvals    Fylnetra Fylnetra (pegfilgrastim-pbbk) is a leukocyte growth factor biosimilar to Neulasta (pegfilgrastim) used to reduce the incidence of...   Vtama Vtama (tapinarof) is a topical aryl hydrocarbon receptor (AhR) modulating agent indicated for the treatment of plaque psoriasis in adults.   Mounjaro Mounjaro (tirzepatide) is a glucose-dependent insulinotropic polypeptide (GIP) receptor and glucagon-like peptide-1 (GLP-1) receptor...   More FDA approvals         My Account     Sign In  Create an account    Recommended Content                  Drugs.com Mobile Apps  The easiest way to lookup drug information, identify pills, check interactions and set up your own personal medication records. Available for Android and iOS devices.  Explore Apps          Support   Help Center  Sitemap  Contact Us     About   About Drugs.com  Advertising Policy  Attribution & Citations     Terms & Privacy   Editorial Policy  Privacy Policy  Updated November 3rd, 2021   Terms of Use        Follow Drugs.com on Facebook       Follow Drugs.com on Twitter       Follow Drugs.com on Pinterest       Follow Drugs.com on YouTube       Subscribe to our Newsletters      Subscribe to Drugs.com newsletters for the latest medication news, new drug approvals, alerts and updates.      Drugs.com provides accurate and independent information on more than 24,000 prescription drugs, over-the-counter medicines and natural products. This material is provided for educational purposes only and is not intended for medical advice, diagnosis or treatment. Data sources include IBM Watson Micromedex (updated 3 May 2022), Cerner Multum™ (updated 28 Apr 2022), ASHP (updated 16 May 2022) and others.               Ad Choices       We comply with the HONcode standard for trustworthy health information. Verify here    Copyright © 2000-2022 Drugs.com. All rights reserved.                     "
interamark.com,service,"  Menu Features Features Features Product Features Upgrade Support Support Support Support Clinical FAQs About About About About epocrates Careers  Use epocrates web   Use epocrates web  Login   epocrates®  You control the course of treatment. We back you up. Make confident decisions in the moments of care with epocrates. Be more confident in the moment of care  Download now—it’s free. Consult the gold standard of current, accurate prescription data*  More than 1 million healthcare providers rely on epocrates. Here’s why.  Get clinical decision support  epocrates delivers the most current safety, diagnostic, and treatment information, right when you need it.   Find what you need, faster  On average, providers report saving 20 minutes or more a day with epocrates*.   Stay focused on your patient  With instant access to the answers you need, your attention stays where it belongs: with the patient.  Get epocrates+ today Unlock additional premium content including:  Disease Information Look up infectious diseases by name or system to view empiric and specific treatment recommendations.  Infectious Disease Treatment Identify in seconds the appropriate antibacterial, antiviral, or antiparasitic agent.  Alternative Medicines Check for possible interactions with brand, generic, and OTC drugs—up to 30 at a time.  Labs & Diagnostic Information Review differentials consisting of drugs, conditions, and other factors that may contribute to abnormal test results.  Learn more about epocrates+’s clinical decision support The clinician's indispensable multi-tool With valuable features including drug information, interaction check, pill identification, clinical practice guidelines, and formulary, epocrates is essential to the busy provider. See what's included with epocrates — and why many providers use the app up to 10 times a day.  Explore epocrates features Meet the experts behind epocrates Our Medical Information team of dedicated pharmacists, physicians, and associates creates the essential clinical content for epocrates. Our team strives to provide information that is objective, accurate, current, concise, and clinically relevant.   Learn how we develop our drug content  * Source: epocrates user feedback, 2018  About About epocrates Careers Features Product Features Upgrade Support Support Clinical FAQs For Business Partners Reach Clinicians Add Your CME Activities  Use epocrates web   Privacy Policy  Terms of Use  Do Not Sell My Information Cookie Preferences support@epocrates.com About About epocrates Careers Features Product Features Upgrade Support Support Clinical FAQs For Business Partners Reach Clinicians Add Your CME Activities  Use epocrates web  Privacy Policy Terms of Use Do Not Sell My Information Cookie Preferences support@epocrates.com                   We use cookies for analytics, advertising, and to improve our site. You agree to our use of cookies by closing this box or continuing to use our site. To find out more, see our Privacy Policy . Cookie Preferences  Accept Cookies Cookie Preferences When you visit our website, we store cookies on your browser to collect information. The information collected might relate to you, your preferences, or your device, and is mostly used to make the site work as you expect it to and to provide a more personalized web experience. However, you can choose not to allow certain types of cookies, which may impact your experience of the site and the services we are able to offer. Click on the different category headings to find out more and change our default settings according to your preference. You cannot opt-out of our Strictly Necessary Cookies as they are deployed in order to ensure the proper functioning of our website (such as prompting the cookie banner and remembering your settings, to log into your account, to redirect you when you log out, etc.). For more information about the First and Third Party Cookies used please follow this link. More information Allow All Manage Cookies Strictly Necessary Cookies Always Active These cookies are necessary for the website to function and cannot be switched off in our systems. They are usually only set in response to actions made by you which amount to a request for services, such as setting your privacy preferences, logging in, or filling in forms. You can set your browser to block or alert you about these cookies, but some parts of the site will not then work. These cookies do not store any personally identifiable information. Performance Cookies   Performance Cookies  These cookies allow us to count visits and traffic sources so we can measure and improve the performance of our site. They help us to know which pages are the most and least popular and see how visitors move around the site. All information these cookies collect is aggregated and therefore anonymous. If you do not allow these cookies we will not know when you have visited our site, and will not be able to monitor its performance. Targeting Cookies   Targeting Cookies  These cookies may be set through our site by our advertising partners. They may be used by those companies to build a profile of your interests and show you relevant adverts on other sites. They do not store directly personal information but are based on uniquely identifying your browser and internet device. If you do not allow these cookies, you will experience less targeted advertising. Back   Clear  checkbox label  label Apply  Cancel Consent  Leg.Interest  checkbox label  label  checkbox label  label  checkbox label  label  Confirm My Choices"
